"Job Title","Company","Location","Footer","Easy Apply","Job Type","Description","Experience Required","Salary Mentioned","Apply Link"
"Full Stack Engineer","Prosperspective HR Solutions","Pune, Maharashtra, India","Viewed | Promoted | Easy Apply","Yes"," Full-time
Matches your job preferences, job type is Full-time.","About the job
About the role
Own features end-to-end across frontend, backend, and deployment. You will also mentor juniors and ensure best practices in system design.
Responsibilities
Architect and build end-to-end features across React frontend and Python/Java backend
Lead integrations with orchestration frameworks (LangGraph, Dify, LangChain)
Design and optimize databases (PostgreSQL, Milvus, PG Vector, AI Search)
Implement CI/CD pipelines and monitoring (Grafana, MLflow, Arize)
Ensure system scalability, security, and reliability
Mentor junior engineers in coding standards, GitHub workflows, and DevOps best practices
Requirements
Strong experience with React, Angular, Python, Java, SQL/NoSQL databases
Familiarity with orchestration (LangChain, LangGraph) and API design
Experience with containerization (Docker, Kubernetes)
Knowledge of monitoring and observability (Grafana, Langfuse, MLflow)
Strong DevOps and GitHub Actions/GitLab CI/CD pipeline skills","N/A","N/A","N/A","LINKEDIN"
"Full Stack JavaScript Developer (React.js)","Scout Inc.","Mumbai Metropolitan Region","Viewed | Easy Apply","Yes"," Hybrid
Matches your job preferences, workplace type is Hybrid.","About the job
Hiring Full Stack JavaScript Developers (React.js) to work on web applications that span frontend and backend. You will leverage JavaScript across the stack to deliver seamless experiences.

Salary: INR 35,00,000 - 45,00,000 / year (based on experience)

Location: Bangalore/Hyderabad/Mumbai/Delhi NCR preferred

Responsibilities

Build reusable components and interfaces using React.js. 
Develop backend logic, APIs, and integrations with Node.js/Express. 
Optimize applications for performance and scalability. 
Participate in code reviews and agile development cycles. 

Eligibility

3+ years of experience in full stack JavaScript development. 
Strong skills in React.js, Node.js, ES6+, TypeScript. 
Experience with SQL/NoSQL databases. 
Familiarity with testing frameworks and DevOps practices. 
Ability to write clean, maintainable, and testable code. 

(*Note: This is a requirement for one of Scout's clients)

Skills: react.js,javascript,react","3 years","35,00,000 ","N/A","LINKEDIN"